cveID,vendorProject,product,vulnerabilityName,dateAdded,shortDescription,requiredAction,dueDate
CVE-2022-23176,WatchGuard,Firebox and XTM,WatchGuard Firebox and XTM Privilege Escalation Vulnerability,2022-04-11,WatchGuard Firebox and XTM appliances allow a remote attacker with unprivileged credentials to access the system with a privileged management session via exposed management access.,Apply updates per vendor instructions.,2022-05-02
CVE-2021-42287,Microsoft,Active Directory,Microsoft Active Directory Domain Services Privilege Escalation Vulnerability,2022-04-11,Microsoft Active Directory Domain Services contains an unspecified vulnerability which allows for privilege escalation.,Apply updates per vendor instructions.,2022-05-02
CVE-2021-42278,Microsoft,Active Directory,Microsoft Active Directory Domain Services Privilege Escalation Vulnerability,2022-04-11,Microsoft Active Directory Domain Services contains an unspecified vulnerability which allows for privilege escalation.,Apply updates per vendor instructions.,2022-05-02
CVE-2021-39793,Google,Pixel,Google Pixel Out-of-Bounds Write Vulnerability,2022-04-11,Google Pixel contains a possible out-of-bounds write due to a logic error in the code that could lead to local escalation of privilege.,Apply updates per vendor instructions.,2022-05-02
CVE-2021-22600,Linux,Kernel,Linux Kernel Privilege Escalation Vulnerability,2022-04-11,Linux Kernel contains a flaw in the packet socket (AF_PACKET) implementation which could lead to incorrectly freeing memory. A local user could exploit this for denial-of-service or possibly for privilege escalation.,Apply updates per vendor instructions.,2022-05-02
CVE-2020-2509,QNAP,QNAP Network-Attached Storage (NAS),QNAP Network-Attached Storage (NAS) Command Injection Vulnerability,2022-04-11,QNAP NAS devices contain a command injection vulnerability which could allow attackers to perform remote code execution.,Apply updates per vendor instructions.,2022-05-02
CVE-2017-11317,Telerik,User Interface (UI) for ASP.NET AJAX,Telerik UI for ASP.NET AJAX Unrestricted File Upload Vulnerability,2022-04-11,Telerik.Web.UI in Progress Telerik UI for ASP.NET AJAX allows remote attackers to perform arbitrary file uploads or execute arbitrary code.,Apply updates per vendor instructions.,2022-05-02
